{
  "edition": "1.0.0",
  "id": "TRANSITION-INTERACTION-IDENTITIES",
  "state": "completed",
  "canonicalOwner": "W7",
  "symbols": [
    "EventId",
    "SubscriptionId",
    "InvocationId",
    "CorrelationId",
    "RouteReservationId",
    "RouteProjectionId",
    "AuditRecordId"
  ],
  "inputs": [
    {
      "owner": "W6",
      "commit": "01a457f9207039ba41aabf1a94f6ab3aaddbfdd2",
      "state": "accepted-input"
    },
    {
      "owner": "W7",
      "commit": "96fbfc9b32ac0ee3705ccfe108ce04f22c83d18c",
      "state": "accepted-input"
    }
  ],
  "remove": [
    "packages/agent-core/src/invocations/id.ts duplicate interaction identifier declarations",
    "packages/agent-core/src/workspaces/id.ts duplicate interaction identifier declarations"
  ],
  "replace": [
    "packages/agent-core/src/interaction-references/id.ts",
    "packages/agent-core/src/interaction-references/index.ts",
    "W6 and W7 barrels re-export the shared constructors"
  ],
  "invariants": [
    "The shared module is a dependency leaf",
    "Every shared interaction identifier instance is frozen",
    "Runtime constructor identity is equal through W6 and W7 barrels",
    "Audit and route codecs decode the shared classes",
    "W6 retains ApprovalId, ReceiptId, EffectAttemptId, claim IDs, and WriteRecordId without owning interaction IDs",
    "W7 workspaces re-exports the W2-owned WorkspaceId constructor"
  ],
  "acceptance": [
    "Wrong-constructor fixtures fail",
    "W6 and W7 barrels are reference-equal to every interaction-references constructor they export",
    "W6 audit and W7 route contracts pass together",
    "No runtime W6/W7 import cycle exists"
  ],
  "blockers": [],
  "completion": {
    "commit": "38872d38a5bc4077f048031680f6db90da49d0ee",
    "tree": "d135133e223653b6f1112bc1623f86d57e10fdbf",
    "artifacts": [
      {
        "path": "packages/agent-core/src/interaction-references/id.ts",
        "blob": "979d934ef7a379ee834037a6775d9957ac296315",
        "sha256": "acd704222692788bfd7a4a17ba104b432279f60824117bb598d338a5c40a40a6"
      },
      {
        "path": "packages/agent-core/test/interaction-references/identity.test.ts",
        "blob": "b39cdde3a9b0b5672e44c7fcd6010e0948d79181",
        "sha256": "1084eb40c94ee8a3857b735fa8359e8b1f0f719c0bdbcc90890fc748e9b9596a"
      }
    ],
    "tests": [
      "test/interaction-references/identity.test.ts#canonical interaction identities re-exports one frozen constructor through W6 and W7 barrels",
      "test/interaction-references/identity.test.ts#canonical interaction identities keeps W2 WorkspaceId and W6 ReceiptId distinct"
    ]
  }
}
