{
  "edition": "1.0.0",
  "id": "TRANSITION-ENVIRONMENT-PIN-IDENTITY",
  "state": "completed",
  "canonicalOwner": "W8",
  "symbols": ["EnvironmentId", "EnvironmentRevisionRecord", "RunPins.environment"],
  "inputs": [
    {
      "owner": "W5",
      "commit": "0fcd7141898615b2234d875ce1018f11c89e354d",
      "state": "accepted-input"
    },
    {
      "owner": "W8",
      "commit": "a6753495cf0bcacc0ada8b76f3fef6b3f54c80f0",
      "state": "accepted-input"
    }
  ],
  "remove": [
    "packages/agent-core/src/agents/source.ts#EnvironmentRevisionRecord",
    "bare RunPins.environmentRevision without EnvironmentId"
  ],
  "replace": [
    "packages/agent-core/src/environments/id.ts#EnvironmentId",
    "packages/agent-core/src/environments/environment.ts#EnvironmentRevisionRecord",
    "RunPins.environment with exact EnvironmentId, Revision, and Digest"
  ],
  "invariants": [
    "W8 remains the sole owner of Environment records",
    "Run state stores only the immutable pin identity",
    "Agent, effective PolicySet, ModelPolicy, and Environment pins each contain their canonical ID, Revision, and Digest",
    "RunConfigurationSnapshot does not duplicate source IDs or digests outside RunPins",
    "A referenced Environment revision remains resolvable while pinned"
  ],
  "acceptance": [
    "Multiple Environment pins cannot alias by revision alone",
    "Run codecs round-trip exact EnvironmentId, Revision, and Digest",
    "Run migration validates the complete target exact-source pin set before installation",
    "W5 source revision verification resolves the W8-owned record without copying it"
  ],
  "blockers": [],
  "completion": {
    "commit": "38872d38a5bc4077f048031680f6db90da49d0ee",
    "tree": "d135133e223653b6f1112bc1623f86d57e10fdbf",
    "artifacts": [
      {
        "path": "packages/agent-core/src/agents/runs/pins.ts",
        "blob": "9e386a2e53bcc5ef94cc877f7cd65ffd5b2f5c71",
        "sha256": "929cb80cf30d4880272fbe86e37acdc99f719bc421e17d95358b5f13296140d9"
      },
      {
        "path": "packages/agent-core/test/agents/runs/foundation.test.ts",
        "blob": "9cc2214f7f83b9ac3985d0af3309c82762be5711",
        "sha256": "426aaf92f98f2de61d241024a9ebdb1a27045a1cdb8d63d89633868b7f52a2bf"
      }
    ],
    "tests": [
      "test/agents/runs/foundation.test.ts#Agent and Run records [C13-RUN-PINS-ENVIRONMENT] round-trips exact source identities and does not alias Environment revisions"
    ]
  }
}
