{
  "edition": "1.0.0",
  "id": "TRANSITION-WORKSPACE-RECORD-PLANE",
  "state": "ready-for-coordinated-integration",
  "canonicalOwner": "W7",
  "symbols": [
    "WorkspaceRecordStorage",
    "MemoryWorkspaceRecords",
    "SqliteWorkspaceRecords",
    "WorkspacePersistence"
  ],
  "inputs": [
    {
      "owner": "W7",
      "commit": "96fbfc9b32ac0ee3705ccfe108ce04f22c83d18c",
      "state": "accepted-input"
    },
    {
      "owner": "W9",
      "commit": "03b1cba72da14c9fc4f93874ba35c7183ba53911",
      "state": "completed"
    }
  ],
  "remove": [
    "packages/agent-core/src/substrates/sqlite/events/records.ts",
    "Event-only naming for the shared Workspace record store"
  ],
  "replace": [
    "packages/agent-core/src/substrates/sqlite/workspace-records.ts",
    "one workspace_records table for every Workspace-owned record kind",
    "one Workspace Actor transaction for attributed contribution materialization and withdrawal"
  ],
  "invariants": [
    "The Workspace Actor is the sole durable owner of its records",
    "Memory and SQLite implement one WorkspaceRecordStorage contract",
    "Catalog, Prompt, Settings, Surface, Ingress, Subscription, View, routing, Event, and retention records use one storage plane",
    "The old Event-only path has no alias or compatibility export",
    "Every attributed Workspace record carries the exact FacetRef and PackagePin"
  ],
  "acceptance": [
    "Packed exports expose SqliteWorkspaceRecords and no SqliteWorkspaceEventRecords compatibility symbol",
    "Memory and SQLite pass the shared workspace-record-storage contract",
    "SQLite restart preserves attributed Workspace records through the renamed adapter",
    "The complete core suite, architecture, ownership, records, seams, coverage, and import gates pass"
  ],
  "blockers": [],
  "completion": null
}
